{
  "schema_version": "2.0",
  "tenant_id": "00000000-0000-0000-0000-000000000001",
  "site_id": "00000000-0000-0000-0000-000000000002",
  "device_id": "00000000-0000-0000-0000-000000000003",
  "ts": "2026-07-18T11:30:05Z",
  "seq": 4711,
  "entities": {
    "5f0d2c9e-6b1a-4c3d-9e8f-0a1b2c3d4e5f": {
      "channels": {
        "soc_pct": 62.5,
        "battery_power_kw": 12.4,
        "pv_power_kw": 18.9
      }
    },
    "6a1e3d0f-7c2b-4d4e-af90-1b2c3d4e5f60": {
      "ts": "2026-07-18T11:30:02Z",
      "channels": {
        "pv_power_kw": 44.2
      }
    },
    "7b2f4e10-8d3c-4e5f-b0a1-2c3d4e5f6071": {
      "channels": {
        "power_kw": -49.7
      }
    }
  }
}
